question,answer
What are some of the common pests and diseases affecting crops in Kerala?,Some of the common pests and diseases affecting crops in Kerala include leaf spot blast wilt rust powdery mildew nematodes and insects like mites thrips and aphids.
What is the government doing to support agriculture in Kerala?,The government of Kerala has launched a number of initiatives to support agriculture including providing subsidies for inputs improving irrigation infrastructure promoting organic farming and setting up farmers' markets.
How can farmers in Kerala improve their productivity?,Farmers in Kerala can improve their productivity by adopting good agricultural practices using high-quality inputs practicing integrated pest management and adopting new technologies and innovations.
What are the main steps involved in the cultivation of paddy in Kerala?,The main steps involved in the cultivation of paddy in Kerala include land preparation sowing of seeds application of fertilizers and pesticides irrigation weed control and harvesting.
What are the benefits of crop diversification for farmers in Kerala?,Crop diversification can help farmers in Kerala reduce their risk of crop failure increase their income and improve the sustainability of their farming practices.
What is the role of cooperatives in agriculture in Kerala?,Cooperatives play an important role in agriculture in Kerala helping farmers to access credit inputs and markets and providing a forum for collective decision-making and problem-solving.
What are some of the popular spices grown in Kerala?,Kerala is known for its rich variety of spices including pepper cardamom ginger turmeric cinnamon clove and nutmeg.
How can farmers in Kerala cope with water scarcity?,Farmers in Kerala can cope with water scarcity by adopting water-saving technologies like drip irrigation using drought-tolerant crop varieties and practicing rainwater harvesting.
What is the importance of livestock farming in Kerala?,Livestock farming is an important source of livelihood for many farmers in Kerala providing milk meat and other dairy products as well as draft power for farming operations.
What are some of the common problems faced by livestock farmers in Kerala?,Some of the common problems faced by livestock farmers in Kerala include poor animal health low productivity lack of access to markets and high feed and fodder costs.
What is the best way to store seeds?,Seeds should be stored in a cool dry place away from sunlight and moisture.
How can I ensure that my seeds are high quality?,It's important to purchase seeds from reputable sources and to check for the germination rate before planting.
What are heirloom seeds?,Heirloom seeds are seeds that have been passed down through generations of farmers and are often open-pollinated meaning they are not genetically modified.
What are some common climate-related challenges for farmers in Kerala?,Farmers in Kerala may face challenges such as flooding drought and pests that thrive in humid conditions.
How can farmers protect their crops from pests without using harmful pesticides?,Farmers can use natural methods such as crop rotation companion planting and biological pest control to minimize pest damage.
What is the role of pesticides in agriculture?,Pesticides are used to control pests and diseases that can damage crops and reduce yields. However their use should be minimized to avoid harmful effects on human health and the environment.
What are some common pesticides used in agriculture?,Common pesticides used in agriculture include insecticides herbicides and fungicides.
What is integrated pest management?,Integrated pest management is a holistic approach to pest control that involves using a combination of methods including natural predators cultural practices and targeted pesticide use to minimize pest damage while protecting human health and the environment.
How can farmers adapt to climate change?,Farmers can adapt to climate change by using drought-resistant crops improving water management practices and implementing sustainable farming practices.
What are some examples of sustainable farming practices?,Examples of sustainable farming practices include conservation tillage cover cropping crop rotation and using organic fertilizers and pest control methods.
What is the best time to plant tapioca?,The best time to plant tapioca is during May to June.
What are the benefits of intercropping?,Intercropping helps to increase the overall yield suppresses weed growth and increases soil fertility.
How to prevent pest infestations in paddy fields?,Using biocontrol agents and natural pesticides can help prevent pest infestations in paddy fields.
What is the ideal temperature for growing cardamom?,The ideal temperature for growing cardamom is between 10°C to 35°C.
What is the best time to plant mango trees in Kerala?,The best time to plant mango trees in Kerala is during the pre-monsoon season from March to May.
What are the common diseases affecting coconut trees in Kerala?,The common diseases affecting coconut trees in Kerala are stem bleeding root wilt and leaf rot.
What are the benefits of using organic manure?,Using organic manure helps to improve soil fertility reduces the risk of soil erosion and increases crop yield.
What are the benefits of using green manure?,Using green manure helps to improve soil fertility increases soil organic matter and reduces the use of chemical fertilizers.
What is the ideal time for pruning coffee plants?,The ideal time for pruning coffee plants is from January to February.
What are the benefits of drip irrigation?,Drip irrigation helps to reduce water usage increases crop yield and improves soil moisture.
What are the common pests affecting tomato plants in Kerala?,The common pests affecting tomato plants in Kerala are aphids whiteflies and fruit borers.
What are the benefits of using neem oil as a pesticide?,Using neem oil as a pesticide helps to control a wide range of pests reduces the risk of chemical contamination and improves soil health.
What is the ideal time for planting ginger in Kerala?,The ideal time for planting ginger in Kerala is from May to July.
What are the benefits of using biofertilizers?,Using biofertilizers helps to improve soil fertility increases crop yield and reduces the use of chemical fertilizers.
What is the ideal temperature for growing black pepper?,The ideal temperature for growing black pepper is between 20°C to 30°C.
What are the benefits of using vermicompost?,Using vermicompost helps to improve soil fertility increases soil organic matter and enhances plant growth.
What are the common pests affecting paddy crops in Kerala?,The common pests affecting paddy crops in Kerala are stem borers leaf folders and green leafhoppers.
What are the benefits of using cow dung as a fertilizer?,Using cow dung as a fertilizer helps to improve soil fertility increases soil organic matter and reduces the use of chemical fertilizers.
What is the ideal time for planting banana trees in Kerala?,The ideal time for planting banana trees in Kerala is during the rainy season from June to September.
What are the benefits of using compost tea?,Using compost tea helps to improve soil fertility increases soil microbial activity and reduces the use of chemical fertilizers.
What is the ideal temperature for growing rubber trees?,The ideal temperature for growing rubber trees is between 25°C to 35°C.
What are the common diseases affecting banana plants in Kerala?,The common diseases affecting banana plants in Kerala are bunchy top disease and Panama wilt disease.
What are the benefits of using fish emulsion as a fertilizer?,Using fish emulsion as a fertilizer helps to improve soil fertility increases soil microbial activity and reduces the use of chemical fertilizers.
What is the ideal time for planting pepper in Kerala?,The ideal time for planting pepper in Kerala is from March to April.
What are some common diseases that affect aquaculture?,Common diseases in aquaculture include bacterial infections parasitic infestations and viral diseases.
How can I prevent disease outbreaks in my aquaculture operation?,To prevent disease outbreaks in your aquaculture operation it's important to maintain good water quality implement a vaccination program practice good hygiene and biosecurity measures and promptly remove sick or dead fish from the population.
What are some common diseases that affect dairy cows?,Common diseases that affect dairy cows include mastitis milk fever ketosis and lameness.
How can I prevent disease in my dairy herd?,To prevent disease in your dairy herd it's important to maintain good nutrition and hygiene implement a vaccination program and promptly identify and treat sick animals.
What are some common pests that affect orchards?,Common pests that affect orchards include aphids mites fruit flies and codling moths.
What are some organic methods for controlling orchard pests?,Organic methods for controlling orchard pests include using beneficial insects practicing crop rotation applying organic pesticides and maintaining good orchard hygiene.
What are some common diseases that affect dogs in a farming environment?,Common diseases that affect dogs in a farming environment include Lyme disease rabies and leptospirosis.
How can I protect my dogs from disease in a farming environment?,To protect your dogs from disease in a farming environment it's important to keep their vaccinations up to date practice good hygiene and sanitation measures and regularly inspect them for ticks and other parasites.
What are some common diseases that affect poultry?,Common diseases that affect poultry include avian influenza Newcastle disease and infectious bronchitis.
How can I prevent disease outbreaks in my poultry flock?,To prevent disease outbreaks in your poultry flock it's important to maintain good hygiene and sanitation measures implement a vaccination program and promptly isolate and treat sick birds.
What are the best crops to grow during the rainy season in Kerala?,Rice banana ginger turmeric pepper cardamom tapioca sweet potato yam pumpkin and cucumber are some of the best crops to grow during the rainy season in Kerala.
What is the average yield per hectare for rice cultivation in Kerala?,The average yield per hectare for rice cultivation in Kerala is around 2500 kg.
What are some common diseases that affect pepper plants in Kerala?,Some common diseases that affect pepper plants in Kerala include foot rot quick wilt and anthracnose.
What is the best time to plant tapioca in Kerala?,The best time to plant tapioca in Kerala is during the summer season between March and April.
How can I control leaf blight in tomato plants?,Leaf blight in tomato plants can be controlled by removing infected leaves providing adequate spacing between plants and using fungicides.
What are some common diseases that affect cashew trees in Kerala?,Some common diseases that affect cashew trees in Kerala include powdery mildew leaf spot and anthracnose.
What is the ideal temperature range for dairy cows in Kerala?,The ideal temperature range for dairy cows in Kerala is between 15°C and 25°C.
What is the best time to prune grape vines in Kerala?,The best time to prune grape vines in Kerala is during the winter season between December and February.
What is the best time to plant onion in Kerala?,The best time to plant onion in Kerala is during the winter season between November and December.
What are some common diseases that affect coconut trees in Kerala?,Some common diseases that affect coconut trees in Kerala include lethal yellowing disease stem bleeding disease and bud rot.
How can I prevent fungal diseases in cucumber plants?,Fungal diseases in cucumber plants can be prevented by providing adequate spacing between plants using fungicides and watering the plants in the morning.
What is the best time to harvest pepper in Kerala?,The best time to harvest pepper in Kerala is during the months of November and December.
What is the ideal pH range for growing pineapple in Kerala?,The ideal pH range for growing pineapple in Kerala is between 4.5 and 5.5.
What are some common diseases that affect ginger plants in Kerala?,Some common diseases that affect ginger plants in Kerala include soft rot bacterial wilt and yellow disease.
How can I control fruit flies in mango trees?,Fruit flies in mango trees can be controlled by using pheromone traps removing infected fruits and using insecticides.
What is the best time to plant banana in Kerala?,The best time to plant banana in Kerala is during the summer season between March and April.
What is the best time to plant cocoa in Kerala?,The best time to plant cocoa in Kerala is during the monsoon season between June and July.
What are some common diseases that affect tomato plants in Kerala?,Some common diseases that affect tomato plants in Kerala include bacterial wilt leaf curl and blossom end rot.
How can I control root rot in cardamom plants?,Root rot in cardamom plants can be controlled by using fungicides providing adequate drainage and avoiding waterlogging.
What is the ideal temperature range for growing turmeric in Kerala?,The ideal temperature range for growing turmeric in Kerala is between 20°C and 30°C.
What is the best time to plant rubber trees in Kerala?,The best time to plant rubber trees in Kerala is during the monsoon season between June and July.
What are some common diseases that affect aquaculture?,Some common diseases that affect aquaculture include bacterial infections viral infections and parasitic infections.
How can you prevent the spread of diseases in aquaculture?,You can prevent the spread of diseases in aquaculture by maintaining good water quality monitoring the health of the fish and practicing good biosecurity measures.
What are some common diseases that affect dairy cows?,Some common diseases that affect dairy cows include mastitis lameness and respiratory disease.
How can you prevent the spread of diseases in a dairy herd?,You can prevent the spread of diseases in a dairy herd by maintaining good hygiene practicing good biosecurity measures and vaccinating the cows against common diseases.
What are some common diseases that affect honeybees?,Some common diseases that affect honeybees include Varroa mites American foulbrood and European foulbrood.
How can you prevent the spread of diseases in a beehive?,You can prevent the spread of diseases in a beehive by practicing good hive management monitoring the health of the bees and treating the hive for Varroa mites.
What are some common diseases that affect dogs on a farm?,Some common diseases that affect dogs on a farm include parvovirus distemper and Lyme disease.
How can you prevent the spread of diseases in a dog population on a farm?,You can prevent the spread of diseases in a dog population on a farm by vaccinating the dogs against common diseases practicing good hygiene and monitoring the health of the dogs.
What are some common diseases that affect poultry?,Some common diseases that affect poultry include avian influenza Newcastle disease and infectious bronchitis.
How can you prevent the spread of diseases in a poultry flock?,You can prevent the spread of diseases in a poultry flock by maintaining good hygiene practicing good biosecurity measures and vaccinating the birds against common diseases.
What are some common diseases that affect pigs on a farm?,Some common diseases that affect pigs on a farm include African swine fever porcine reproductive and respiratory syndrome and swine influenza.
How can you prevent the spread of diseases in a pig herd?,You can prevent the spread of diseases in a pig herd by maintaining good hygiene practicing good biosecurity measures and vaccinating the pigs against common diseases.
What are some common diseases that affect goats on a farm?,Some common diseases that affect goats on a farm include caprine arthritis and encephalitis foot rot and Johne's disease.
How can you prevent the spread of diseases in a goat herd?,You can prevent the spread of diseases in a goat herd by maintaining good hygiene practicing good biosecurity measures and vaccinating the goats against common diseases.
What are some common diseases that affect sheep on a farm?,Some common diseases that affect sheep on a farm include foot rot pneumonia and Johne's disease.
How can you prevent the spread of diseases in a sheep flock?,You can prevent the spread of diseases in a sheep flock by maintaining good hygiene practicing good biosecurity measures and vaccinating the sheep against common diseases.
What are some common diseases that affect cattle on a farm?,Some common diseases that affect cattle on a farm include bovine respiratory disease bovine viral diarrhea and bovine tuberculosis.
How can you prevent the spread of diseases in a cattle herd?,You can prevent the spread of diseases in a cattle herd by maintaining good hygiene practicing good biosecurity measures and vaccinating the cattle against common diseases.
What are some common diseases that affect horses on a farm?,Some common diseases that affect horses on a farm include equine influenza.
What is soil?,Soil is a natural resource made up of organic and inorganic materials that provide a medium for plant growth.
What are the major soil types found in Kerala?,The major soil types found in Kerala are laterite soils red loamy soils and coastal sandy soils.
What is laterite soil?,Laterite soil is a type of soil that is rich in iron and aluminum and is found in areas with high rainfall and hot and humid climate.
What crops can be grown in laterite soil?,Crops like tapioca banana coconut and cashew can be grown in laterite soil.
What is red loamy soil?,Red loamy soil is a type of soil that is rich in iron oxide and clay and is found in areas with moderate rainfall.
What crops can be grown in red loamy soil?,Crops like paddy sugarcane pepper and ginger can be grown in red loamy soil.
What is coastal sandy soil?,Coastal sandy soil is a type of soil that is found in coastal areas and is characterized by its low fertility and high salinity.
What crops can be grown in coastal sandy soil?,Crops like coconut cashew and vegetables that can tolerate high salinity can be grown in coastal sandy soil.
What is soil fertility?,Soil fertility is the ability of soil to provide essential nutrients to plants for their growth and development.
What factors affect soil fertility?,Factors like soil pH organic matter content nutrient availability and soil structure affect soil fertility.
How can you improve soil fertility?,You can improve soil fertility by adding organic matter using fertilizers improving soil structure and maintaining proper soil pH.
What is soil structure?,Soil structure refers to the arrangement of soil particles into aggregates or clumps which affects the soil's ability to hold water and nutrients.
How can you improve soil structure?,You can improve soil structure by adding organic matter avoiding soil compaction and practicing crop rotation.
What is soil pH?,Soil pH is a measure of the acidity or alkalinity of soil which affects the availability of nutrients to plants.
What is the ideal soil pH for most crops?,The ideal soil pH for most crops is between 6.0 and 7.0.
What can cause soil acidity?,Factors like acid rain use of acid-forming fertilizers and leaching of basic cations can cause soil acidity.
What can cause soil alkalinity?,Factors like high levels of sodium and bicarbonate ions and the use of alkaline fertilizers can cause soil alkalinity.
How can you adjust soil pH?,You can adjust soil pH by adding lime to acidic soil to increase pH and adding sulfur to alkaline soil to decrease pH.
What is soil erosion?,Soil erosion is the process of loss of soil due to water or wind.
What are the causes of soil erosion?,Causes of soil erosion include deforestation overgrazing improper tillage practices and heavy rainfall.
How can you prevent soil erosion?,You can prevent soil erosion by planting cover crops practicing conservation tillage using terracing and contour farming and maintaining proper vegetation cover.
What is soil moisture?,Soil moisture refers to the amount of water present in soil.
Why is soil moisture important for plant growth?,Soil moisture is important for plant growth because it affects the uptake of nutrients and the transport of dissolved nutrients in the soil.
How can you measure soil moisture?,Soil moisture can be measured using a soil moisture meter or by checking the soil's appearance and texture.
What is soil compaction?,Soil compaction is the process of soil particles
What is soil pH?,Soil pH is a measure of the acidity or alkalinity of soil.
What is the ideal pH range for most crops?,The ideal pH range for most crops is between 6.0 and 7.0.
What is soil texture?,Soil texture refers to the proportion of sand silt and clay in a soil sample.
What is the best soil texture for most crops?,The best soil texture for most crops is a loam which has a balanced mixture of sand silt and clay.
What is soil structure?,Soil structure refers to the way that soil particles are arranged into aggregates or clumps.
What is the importance of good soil structure?,Good soil structure promotes good root development and water infiltration.
What is organic matter?,Organic matter is decaying plant and animal material that is present in soil.
What is the importance of organic matter?,Organic matter improves soil structure increases water-holding capacity and provides nutrients for plants.
What is soil fertility?,Soil fertility refers to the ability of soil to support plant growth.
What are some factors that affect soil fertility?,Some factors that affect soil fertility include pH organic matter content nutrient content and soil texture.
What is a soil test?,A soil test is a laboratory analysis of soil to determine its nutrient content pH and other properties.
Why is a soil test important?,A soil test can provide information about nutrient deficiencies and pH imbalances allowing farmers to apply the appropriate fertilizers and soil amendments.
What is nitrogen fixation?,Nitrogen fixation is the process by which certain bacteria convert atmospheric nitrogen into a form that plants can use.
What is the importance of nitrogen fixation?,Nitrogen fixation provides a natural source of nitrogen for plants reducing the need for synthetic fertilizers.
What is a cover crop?,A cover crop is a crop that is planted to protect soil from erosion improve soil health and reduce weed growth.
What are some examples of cover crops?,Some examples of cover crops include clover rye and buckwheat.
What is crop rotation?,Crop rotation is the practice of growing different crops in the same field in a planned sequence.
What is the importance of crop rotation?,Crop rotation can help reduce soil erosion prevent the buildup of pests and diseases and improve soil fertility.
What is a greenhouse?,A greenhouse is a structure designed to maintain a warm and humid environment for growing plants.
What are some advantages of greenhouse farming?,Some advantages of greenhouse farming include year-round production protection from pests and weather and precise control over growing conditions.
What is hydroponics?,Hydroponics is a method of growing plants without soil using nutrient-rich water instead.
What are some advantages of hydroponic farming?,Some advantages of hydroponic farming include faster growth rates reduced water usage and higher yields per unit of area.
What is a frost date?,A frost date is the average date in a given area when the last frost of the season occurs.
Why is knowing the frost date important for agriculture?,Knowing the frost date is important for planting crops that are sensitive to frost as planting too early can result in crop loss.
What is a hardiness zone?,A hardiness zone is a geographical area that is defined by its average annual minimum temperature.
Why is knowing your hardiness zone important for agriculture?,Knowing your hardiness zone is important for selecting plants that are adapted to your climate as different plants have different temperature requirements.
What is a microclimate?,A microclimate is a small area with its own unique climate often caused by features such as buildings or terrain.
What is the ideal temperature range for growing maize?,The ideal temperature range for growing maize is between 20-30°C.
What is the best time to harvest wheat?,The best time to harvest wheat is when the kernels are fully ripe and the moisture content is around 13-14%.
How do I prevent soil erosion on my farm?,You can prevent soil erosion on your farm by planting cover crops maintaining vegetative cover and implementing conservation tillage practices.
What is the recommended amount of nitrogen fertilizer for growing tomatoes?,The recommended amount of nitrogen fertilizer for growing tomatoes is 100-120 kg/ha.
How can I control aphids on my crops?,You can control aphids on your crops by introducing natural predators like ladybugs using insecticidal soap or spraying neem oil.
What is the best time to plant rice?,The best time to plant rice is during the monsoon season when there is ample water supply.
How can I control weeds on my farm?,You can control weeds on your farm by practicing crop rotation mulching and using herbicides.
What is the ideal soil pH for growing strawberries?,The ideal soil pH for growing strawberries is between 5.5-6.5.
What is the recommended irrigation method for growing corn?,The recommended irrigation method for growing corn is drip irrigation.
How can I prevent fungal diseases on my crops?,You can prevent fungal diseases on your crops by practicing crop rotation using fungicides and maintaining good air circulation.
